,Name,Title,Body,Stars
0,Michelle M,Best slime ever,"We absolutely loved this slime. It’s super pretty with tons of metallic shine but not glitter that gets everywhere. The slime isn’t all sticky and goopey…it’s more together and so it makes no mess. It’s not super crazy stretchy, but I like that my girls can play with it without getting it all stuck in their hair or my carpet if it drops. The packaging was really on point too, and my girls loved popping open each globe to get their slime. We put them in goodie bags for my 6 year old’s bday, and everyone loved them!",5.0
1,Tison,Broken one but great for party bags,Great for party bags - but make sure to order enough: my set came with a broken  one. I don’t know if it’s easy to clean (asked that I rate that),4.0
2,Customer,Quality texture and consistency for price,"I have purchased these twice now to put in gift bags for my kids birthday parties. You cant go wrong with slime, always a kid fav and these provide good quality and value.",5.0
3,Shelly,Cool party favor,"Yes, I need to get a manicure but, you’re welcome for the picture 😂",4.0
4,CE Brown,Worth the money,My second time purchasing these. Got for my 13yo’s and now for my 5yo’s party. Slime is always a big hit!,5.0
5,Ildiko jolly,Slime,I put these in party gift bags kids love them,5.0
6,Amazon Customer,👌,My kids loved the slime and it's not messy.,5.0
7,Sollie jones,Small,Product is fine. Beware of the size however. It is smaller than it would appear.,3.0
8,Michelle Wasicek,~ Slime is fun~,Very awesome kit I must say and was a nice gift for a child.,5.0
9,Belinda,Great,Product is great,5.0
10,Edward,Good slime,"We bought two boxes of these to give away at a kids party and they worked out perfectly. This is the good slime, the kind that doesn't make a mess but is still slimy.",5.0
11,Brittany,Good buy,Recommending!,5.0
12,Mamaloo,Goodie bag filler,I am not sure about the stretch or scent.They were convenient to put into goodie bags as a favor.,4.0
13,Tara Ramirez,Kid and mom approved,"I bought this for a bday gift for a child w/ sensory issues because of the reviews. They were not wrong. The child loved it, the mom approved. If I could change one thing, I wish it was sold in larger containers. The 24 containers are very small. They ended up opening and placing in one large one.",5.0
14,amanda,Love,I got them to hand out to the kids of parents I don't like for Halloween once this slime dries its never really all coming off I would recommend I buy them all the time for this,5.0
15,Lacey,best slime,"I really appreciate the slime the most because it didn’t stick to my furniture. I don’t know how they did it but it’s the best slime we’ve ever had in our house. Also, it’s really cute colors very futuristic.",5.0
16,Amazon Customer,Haha packaging not labeled,"Decent quality slime but these ones don’t come labeled either, once they’re out the box they’re apparently easily confused for bouncy balls. Smashed casing and upset kids for sure",5.0
17,April,Pretty decent but…,..as I’ve noticed from other reviews one of slime balls was defected. They didn’t really have much stretch either.,3.0
18,Stacey Burns,Some almost dried out,Got this and some of the slime is almost dried out!But I’m not complaining because I throw a lot of slime away! Perfect little doses of slime for younger kids,3.0
19,Mark,Kids loved it!,These were perfect for birthday favor bags and Halloween treats! Great value.,5.0
20,Kristen Williams,Not a fav.,4 out of the pack had separated and were not usable.,3.0
21,eric,Great for kids gift bags,Small for kid's gift bags. Not sticky and easy to clean after.  Looks nice in container however it turns brown once they play with it.,5.0
22,Malaine,Galaxy,Kids love the slime. The colors were lit,5.0
23,Claudiyve,Disappointing but salvagable,"The media could not be loaded.




 I was super disappointed by this slime. It has like no stretch to it. Like as soon as I opened it and tried it the slime broke to pieces in my hand. After a few rubs it softens but still has no real stretch to it so of course it's easy to clean. I was disappointed as planned to use them as stocking stuffers for my nephews. I was able to save it however by getting a Mason jar and putting water in it and leaving three if them in the jar over night. In the morning it was much more slime like. It still breaks apart but has a lot more stretch though also a bit sticky but not too much and still easy to clean.",2.0
24,jbrown46,Wish I had read the reviews,"I ordered these without looking at the reviews super closely, which is my mistake. Our package arrived intact, but out of 24, two are completely liquid and not slime at all. I needed all 24, so now I’m stuck trying to find two replacements. That said, the slime seems perfect for our Star Wars party bags but I can’t comment on the actual slime yet as we haven’t opened any of them.",3.0
25,Nina,Not the stretchy kind,"If you want the kind that can stretch and be folded back together, this is not it. It’s got a jello consistency and doesn’t last for more than a 10 min play time. One of the little containers was extremely watery.",3.0
26,Amazon Customer,Not very stretchy.,"My order arrived in tact with all of the slime balls. They look beautiful! There are 18 galaxy slimes and 6 single color slimes with plastic fruits and beads in them. Super cute!However, I opened one up to try it and the quality of the slime is rather low. I was not impressed. It doesn't stretch very far, instead it just kind of breaks. If you warm it up a bit it stretched a bit more but you have to do it very slowly. The colors also mixed together really quickly.On the bright side, it doesn't seem to stick to anything so it's pretty easy to clean up.Overall, I don't think I would buy these again.",3.0
27,Dree21,Really small but cute favors,I didn’t expect for them toBe so small otherwise they are very cute just really  tiny but I suppose that’s why they are so small because they are only favors,4.0
28,Amazon Customer,Super Tiny,"Super tiny containers, not what I expected.",3.0
29,bettina calzada,Cute,Great quality,5.0
30,Bmore corgis,Good party favor.,"Bought these as party favors and had some left over that my kids glooped all together. Good consistency slime, no scent.",5.0
31,Ikeyla Janee’,"This is NOT sticky, Mom approved!",Gave these out as party favors for my son's 7th birthday ONLY because they were stretchy and beautiful and did NOT stick to my hands or my table. Highly recommend.,5.0
32,Wendy N.,"Super fun, value for money","Took them to my job, nurse on ortho neuro floor. All the employees, and some patients loved them. Great stress reliever but they are difficult to get out  of fabric. Just have to be careful",5.0
33,Pam,Great for Easter Baskets Party Favors Stockings,"Great item that can be used in so many ways! Easter egg hunts, Easter Baskets, Party Favors, and Christmas stockings! Great price on a a lot. Kids love slime.",5.0
34,Sunny,a little smaller than expected,It was used for a grab bag gift,3.0
35,Rebekah,melted,it came with more than half of the slimes melted,3.0
36,Linda Halbert,Stretching abilities,"The media could not be loaded.




 I did like the colors but it clumps instead of stretching",5.0
37,Queen,party favors,i used these as fillers in the goody bags for my daughters birthday. They did help filler the bags and my daughter loved them. I had extras to keep at home for my other kids. I love the value a lot of party favors dont come with 25+. its always 12 or 10 or 20. I always want to avoid having to buy 2 of an item and just use 2 or 3 from the pack. I was glad this came with more than enough,5.0
38,Younglady,"Very Sticky, no easy to clean!!","I bought this for Christmas for my grandson, however I was very disappointed, did not like at all. When we were opening the balls, it was not easy, and the slime was very sticky, had to be very careful to not stick at other things.",3.0
39,KH,This slime was a perfect addition to my daughters kindergarten Valentine’s Day goodie bags!,"The slime was very pretty and kept its galaxy look even after played with.It wasn’t super stretchy but it was jiggly.It didn’t stick to anything,And is the perfect amount for a classroom exchange/goodie bag gift.",5.0
40,Danielle ,Good deal,"This is definitely worth the price for as many slimes as you get and they all came nice and securely packaged so it wasn't a slime cover mess when I opened the box which I was pleasantly surprised about. I bought these to use in goodie bags for my kids birthday party and I'm sure it will be a hit, especially with the galaxy colors. Overall I would recommend for at home play, goodie bags, or even a fun classroom treat.",5.0
41,Amazon Customer,Perfect for a kids' birthday party!,Perfect for a kids' birthday party!,5.0
42,Amy Keating,Slime? Nope. Soup!,"The media could not be loaded.




 SEVERAL of the small jars inside the box were totally liquified and not slime at all.  Very disappointing as I had ordered these for my class and now do not have enough to give one to each student :(",2.0
43,Sam,You have to work them to get the consistency correct.,"I got these for my classroom. I am picky about the slime we bring in... as so much of it sticks to the clothing.This was fun... they loved it... until we opened the balls and they just smashed it into tiny pieces of disappointment. I was sad...But then I just kept mindlessly playing with it and realized you have to really work the stuff together to make it malleable. The colors of course mix together more... which is probably why it's not as processed as it should be, to keep the colors clearer.Anyway, just in case anyone else had that issue.",4.0
44,MLJ ,Some were stretchy and some weren’t,Packaged in the product box. It was pretty small but perfect as party favors. Some of them were stretchy and some were really dry. I’d still prefer them over sticky messy slimes.,3.0
45,LnASmom,Great party favors!,This was a big hit as party favors for ages 5-13 really! Big kids love slime for some reason and are still amused with it and little kids can’t get enough of the stuff. I’m not a big fan of the container because if it breaks the slime willDry up. As a parent I am thrilled with this slime as it doesn’t get stuck on the couch or on walls like other types of slime does!,5.0
46,Brooke B.,Finally a slime that doesn't stick to everything,"Love the texture of this slime. It doesn't stick to your hands or other objects. Purchased these for toddler gift bags and they were a huge hit! Came perfectly packaged and all were very colorful. If the slime comes apart after handling for awhile, just stick it back in the container and it will congeal again after 10 minutes. The colors will eventually run together making a purple/grayish color after playing with it about a dozen times, but that is expected. My toddler still finds it fun to play with.",5.0
47,Jessica,"Not slime, just water like liquid.","The media could not be loaded.




 I purchased this to use as party favors for my son's birthday, but after opening the package I discovered half of the slime containers were just liquid. They had the consistency of water and were completely unusable. I'm not sure if this was a bad batch, or something else happened, but I didn't have enough good ones for all party guests and would not recommend to other buyers.",2.0
48,Alyssa Jade,perfect for a party,this was the perfect party favor for my daughters birthday party!,5.0
49,queenie,Kids love this,Great party favor for a wide range of ages 3-13,5.0
50,Kindle Customer,not slime,This product is not the slime that I was expecting.  It feels like jello and breaks apart into pieces.  my daughter didn't like and neither did I.  It's not worth the price and I would not recommend this product to anyone.,3.0
51,Stezig,"Kids enjoyed, container a little small though","Bought these to stick in kids gift boxes for a birthday party. The containers were a little smaller than I imaged they'd be, but the kids enjoyed them and thats what matters!",4.0
52,Amber Rogers,Very watery,Product was very small and watery.,2.0
53,elsie,Great fun for the littles,"I am using this as part of my daughters birthday goodie bags to her friends. I love the small individual containers. Perfect for what I need. The colors are amazing, very cool to look at and touch. One negative thing i just say is when I pulled the slime apart just playing with it, small peices started clinging to my hands. And everywhere else. Washed right off though. Will be a hit at her birthday im sure.",4.0
54,Alaina Masterson,Great party favor !,"Such an awesome party favor! The little slime balls also had little ducks, pearls and cute things inside the slime! Totally worth it! My son was very happy!",5.0
55,Maile,"Not really slime, but kids liked it!","This product is not very slime like, but the kids still liked it. It’s more like a squishy moldable play gel. If you try to stretch it, it breaks apart rather than stretch. Overall, nice product. The colors are super cool. But if your looking for good slime, this is not the stuff.",4.0
56,DS,Party goody,I had a kids outdoor movie night. This was put in the goody bags. I just thought they were a little bigger. Other than that they were a good buy,4.0
57,Teddie Melson,Little slime,It is a Galaxy looking slime that does not get mixed up.  But maintained its colors.,5.0
58,Tinker Belle,Love it,Perfect party favor,5.0
59,Sue,Not bad minus strong smell,"There were a hit as party favors. There is a strong, overwhelming anatomy lab, embalming smell. Being in science I am somewhat used to it, but if you are not into strong chemical smells this might not be the product for you.",4.0
60,Amazon Customer,Galaxy Slime Balls,"Got these as party favors for my daughters 3rd bday party unicorn theme and they came in a box wrapped individually and the varieties was awesome! They were perfect fit with the other party favors and the kids LOVED IT!!! The only reason why I didn't give 5 stars is cuz it is messy and hard to get out of hair, carpet which happened! UGH but honestly is there a slime that isn't messy??? HAHA great though!",4.0
61,Ashley C,Adults loved them,"Gave these to my coworkers for the holidays.  They become unusable very quickly when played with consistently.  We got 2-3 days of continuous use.  Do not leave sticky residue on hands or surface.  It was worth it.  We all enjoyed them.  Only complaint was how quickly they ""died"" and the odd smell",4.0
62,Daniela Anet,Meh,"They’re what’s advertised except that the slime was old and close to being completely dry.  The slime was not stretchy and slimy like slime is supposed to be. However, my daughter is only three so she didn’t really care, all she does with slime is mix and squish and use it like pretend food and these were good enough for her. But there would have been a lot of disappointed kids had I used this as party treats",3.0
63,Becky,Awesome Product!  Highly recommend!,Excellent product!!!!!!!  My son gave these out in his party bags at school.  Item was boxed nicely and each slime was sealed which was even better for the schools rules with covid!  My kids loved playing with the slime!  Colors were beautiful!!  I will definitely order this product for additional parties etc!,5.0
64,Amazon Customer,Not slime,"The media could not be loaded.




 If I could give negative stars I would.  It’s not slime at all, it’s more of a play-dough consistency. It tears apart instead of stretching like slime. Extremely disappointed with this purchase.",1.0
65,Akaisaru7,Small cups,"The cups are really small, but for the price, worth it for party favors.",4.0
66,Oscar Arias,Poor quality,I received slime that was drying out and not stretchy at all. The liquid was leaking out of some of the plastic balls. Would not buy again.,1.0
67,Jess S.,Love the clear slime but hate the ball container,"The media could not be loaded.




 There were 6 clear slime balls in the set, and surprisingly my daughter likes the clear ones more than Galaxy balls. They are so cute to have little figures and fruits confetti inside. My daughter spent quite a long time playing with them. However, I found the clear slime is more watery or liquid than regular ones, so very easy to get sticky on hands. And the ball container is the weak part. It's made of cheap plastic and super easy to get cracked. Once the container got cracked, the slime became dry quickly.",3.0
68,Iris Blume,Perfect for my students,I gave these out to my students in the class prize box. They were definitely a favorite.,5.0
69,Rebeccah,Great value,Great value for end of year third grade gift bags,4.0
70,Jessica Reime,Awful,I bought these for my students and I am so disappointed I wasted my money on these. The texture is weird and watery. It doesn't recombine or combine with the others it came with. I seriously regret buying this garbage.,1.0
71,Amazon Customer,Awesome price awesome product!,"I cannot rave enough about these! I used them in my sons favor bags for his birthday. They are about the size of a golf ball. The slime doesn’t stick to anything ESPECIALLY carpet or hair. If it is left out, it does harden, which is fine because in my opinion he should have taken better care of it!! The box came with a few that had little trinkets in the slime which was really cool!!",5.0
72,Lynn Rich,Not too sticky!!,This Slime is awesome! The kids loved it and it was individually sealed so you don’t have to worry about it going bad if you don’t use it quickly! It wasn’t too sticky like some slime can be! It did start to come apart a little after the kids played with it for awhile but that’s to b expected!,5.0
73,Tyiesha Sempa,Great little bouncy slime balls,"I cringe at the idea of slime, but with three daughters ranging from ages 3 to 8, it is almost unavoidable. What I like about this slime is the texture. It can change shapes but isn’t slimy and sticky where it gets stuck on fabric, clothes or carpet. The sphere container it comes in is reusable for easy storage. I gave them away as part of the grab bag goodies for my daughters’ birthday.",5.0
74,Jenny,Great Easter egg stuffers!,"The kids loved finding slime in the Easter eggs. There was a good mix of different colors.  As a mom, I appreciate that the ball stays closed and doesn't leak slime on my furniture 😊",5.0
75,Frank Ome,Cute little slime balls.,Really nice balls of slime. I love that it comes with some clear slimes with decorations in them. These would be perfect as party favors.The slime does have to be worked a bit more than other slime to become a more slime-like consistency.,4.0
76,CGC,It was a hit.,"All parents cringed when they saw these little slimes in the gift boxes at my son’s birthday party, but thanksfully they were pleased that they were not sticky or messy at all.",5.0
77,Shelly velazquez,"Teachers, parents… Do not buy these!!!","It falls apart in your hands it’s not stretchy at all it’s crumbly and it smells like chemicals, the most horrible slime I have ever purchased for my students. Do not waste your money!",1.0
78,April Wilkerson,Kids loved it,These are small little slimes but they were perfect for my elementary schooler. The color is beautiful as shimmery and they do not smell weird like other slimes which is great.,5.0
79,Good,Good quality,"Good quality for the kids. After they played with it, they could put it back in the ball and it turn right back to the original shape!!",5.0
80,lizzerdking77,Great value,"Great value for the money,",4.0
81,Graceyolanda,Great party favor,Got these to add to my daughters goody bags. We opened one right away and the slim was perfect. My daughter said it feels so nice and it does. Also feels like non messy too which is great !,5.0
82,Katrina,Garbage,Bought this for kids party bags and they are trash. They are super watery and come apart in to a million little pieces . Had to clean it multiple times off tables and floor.Would not recommend or buy again.,1.0
83,April Robles,Good quality - as described,Well packaged.  None were leaking or damaged - all tightly closed with plastic seal.  Good variety for boys and girls. My daughter gave these as a stocking stuffer to her 2nd grade class.  They were well liked.,4.0
84,Martisha B Lanuza,Compact,It came in a nice sturdy box and very neat for the kids,5.0
85,Brandon Michael Wininger,Consistency better than slime,Purchased for birthday party gift bags. The slime is a thicker consistency than most ‘slime.’ Each ball was wrapped in plastic and hard to remove but the slime itself was great for all ages. 3-13,5.0
86,Charles Hagan,All Slime Should Be Banned,Forget all about slime.,4.0
87,G. Ferrell,Doesn't work!,Not stretchy like in the video. The majority does not stretch. You'd have to go through each one to find one that actually resembles slim.,1.0
88,JL,Crumbly!! Do not buy,Slime is crumbly and not like what is advertised.,1.0
89,Merline,Good,Great gifts for kids,4.0
90,Tabitha Thompson,Not Slimy,It's like play doh. Wasn't slimy like i expected.,1.0
91,Kindle Customer,"There are only 20 galaxy balls and 4 ""charm"" balls not safe for younger children",I was a little disappointed because I thought there were 24 galaxy glitter balls. There are 20 included and 4 that are clear with tiny charms inside. I lucked out because we only needed 20 but if I had needed 24 I would have been out of luck. The charms inside the clear balls were so small they would pose a safety hazard for young kids.,3.0
92,Ashlee McLoughlin,Keeps kids occupied with fun!,"Love this slime!  I bought it to give out to my son’s class. It’s not messy or sticky, so it’s an easy clean up!  Leaves my boys occupied for a while. I definitely recommend this slime!",5.0
93,Wilma,small,much smaller than I expected.,4.0
94,Kathleen G.,Does not do what videos and pictures show,"Find a better slime, this does not act like slime. It’s a stiff non-stretch cold puddy. Doesn’t “pour” or stretch like real slime. Very pretty looking? But such a waste—would have returned but I packed them all up for birthday party favors and didn’t know until my son opened one later.",1.0
95,Rizza Ray,Water not slime,"The media could not be loaded.




 Got this for my sons party favors and more than half are liquid, not even slime. You open and it just pours out like water.. super disappointed",1.0
96,Ystroud,Great Slimy Fun,"I used the slime during my summer camp. It was easy to handle and wasn't sticky. This made for good, clean fun for the kids.",5.0
97,AThane,Nice gifts for treat bags,"Love that it’s not sticky, but it does tear apart way too easily. Was hoping it would be a little like silly putty, but still awesome.",5.0
98,BTrinh,Safety concern!,"What initially was entertaining for my daughter, turned out to be a safety concern. The slime somehow melted into her blanket and ended in her hair. It took a while to clean out. Also the small pieces in the slime resembled candies which can easily be removed from the slime and potentially be mistaken and swallowed. Definitely be cautious. Would not buy again.",1.0
99,Marydale Farm,"Not your average gross sticky slime, smells great",This slime is great. It doesn’t stick to other stuff and get nasty. And surprisingly smelled awesome as well. I Bought them as party favors and got another box for Christmas just to have on hand.,5.0
100,Amazon Customer,My kids love it,My kids love it but is slight messy for me to clean.  You know what you are buying. This really isn’t a surprise.,5.0
101,Amazon Customer,Defective! Waste of money!: Update wait! You have to warm it up a little,"The media could not be loaded.




 This slime is not slimy does not stretch it’s very stiff and rips apart I do not recommend this product at all! Update: after heating the slime it stretched again. I think this slime is just too cold. It’s not the greatest but i think after it warms up to the air in a warm room it melts better.",3.0
102,Jessica at Cracking the Cover,short-lived novelty,"I purchased these for a space birthday party. While cute, the tubs are tiny. The entire thing of slime easily fit in my 6-year-old's hand. The kids thought it was cool — it feels awesome — but were soon asking what they were supposed to do with it. It's a fun novelty, but doesn't have the longevity of playdough or some of the other sculpting products. It is very easy to clean up, which is a plus.",3.0
103,Gayla coleman,Product is amazing,I wasn't sure at first if this slime would be a good present for my 3yr old daughter because alot of slimes are very sticky and messy but surprisingly this slime isn't its super easy to clean up and the colors are very pretty and it's cool to the touch,5.0
104,Amazon Customer,Great for kid prizes.,Supper fast shipping. I ordered it to give out as prizes to children in our church kids program.,5.0
105,Pinky,Great!,My grandson loves this stuff and this one made him so happy.  I recommend,5.0
106,Pamela R. Evans,Sticky Party Gift,"This sticky party gift was bought for the kids. You can stretch and pull the mucus by squeezing, and it's very depressurized. Non sticky mucus, super elastic, soft, non-toxic, safe, can let children rest assured to play. It's worth buying.",5.0
107,granny b,"Galaxy Slime, Party Favor for Kids Girls & Boys was Sticky and created Stress & Anxiety for me.","I didn't like the slime party favor.  It looked cute and my girls love to play with slime.  but Galaxy Slime, Party Favor for Kids Girls & Boys was watery, a loose puddle they could not play with.",1.0
108,liby tomy,Super,N/a,4.0
