,Name,Title,Body,Stars
1080,Client d'Amazon,,Très belle qualité et doux au toucher.  Se remet facilement dans son contenants et reprend sa forme,
1081,Amazon Customer,,"The media could not be loaded.




 The galaxy slime comes in very tiny containers that are suitable for party favours only. The slime itself feels like mucous lol, the kids were kind of grossed out by it. Overall I feel like the product is overpriced.",
1082,Ruth,,"These slimes are incredibly good, their consistency is great, no residues all over... The colours were fun for the kids and the ones with the charms were lots of fun! They stretch well with some massaging just as indicated in the pack, will have them in mind for other birthdays... They were a hit! My kids and friends love them!",
1083,Ele Genov,,"Le sfere sono piccolette, lo slime e morbido ma non appiccica molto, ottimo perché non sorca gli abiti e si recupera bene. Alcune sfere hanno all'interno perline o animaletti, che piacciono alle bimbe. I colori sono vivaci e simpatici, prevalentemente sul blu e verde, ma anche rosa e arancio. Io le ho comprate come pensierino per i bimbi invitati alla festa di compleanno di mia figlia, avevano tutti tra 5 e 8 anni, e hanno apprezzato. Il prezzo è contenuto per il numero di perle presenti nella scatola: confezionate in una bella scatolina rettangolare colorata",
1084,Amazon Customer,,The colours are really cool but the quality of the slime sucks. There’s no stretch and once it breaks apart it doesn’t go back together. Then you get these tiny pieces of slime everywhere. I won’t buy again. Wish I could return it but opened a few containers already. Do not recommend.,
1085,Giovanna Caruso,,"Ho acquistato queste palline per aggiungerle alla gift box di fine festa per gli amichetti di mio figlio.  Nonostante alcune recensioni negative sulla consistenza dello slime,  ho rischiato, le ho scelte perché sembrano dei piccoli pianeti e sembravano perfette per il tema Spazio che avevamo scelto. Beh, siamo stati fortunati perché, oltre che davvero molto carine, lo slime all’interno aveva un’elasticità è una consistenza perfette.",
1086,AnGra,,"Ich habe diese Schleimkugeln für meine Tochter bestellt. Sie hat sich sehr darüber gefreut. Gut finde ich, dass es einzelne Kugeln sind und man nicht auf einmal einen riesen Schleimbatzen hat. So kann man immer mal eine Kugel öffnen und den "" Schleim"" nachdem Spielen wieder in der Kugel verstauen. Er sieht auch sehr schön aus und hat teilweise kleine Figuren drin. Was nicht so toll ist, dass er etwas chemisch riecht und man den Schleim leider nicht so ziehen kann, wie beschrieben. Er ist relativ fest und bricht schnell auseinander. Er klebt auch super auf Teppichen u.ä. Also hier aufpassen!",
1087,N. M.,,"Der Slime reißt leicht, damit tut er nicht was zu erwarten ist. Und er riecht stark nach Chemie. Daher nicht empfehlenswert.Nette Farben immerhin.",
1088,frances goyetche,,The price is a little high for the size,
1089,Michele,,"Il prodotto sembra vecchio, poco elastico, non è come il classico slime. Non ho fatto il reso solo perché mia figlia l'aveva già visto e ha voluto subito giocarci. Non si sbriciola ma ha la consistenza della plastilina e non degli slime. Saró stato io sfortunato... Non consiglio l'acquisto.",
1090,Sabrina Kaufmann,,Die Kinder haben sich sehr über die Bälle gefreut. Einige wenige Bälle hatten kleine Perlen im Schleim. Sie wurdem am Kindergeburtstag verteilt. Leider ist der Schleim aber alles andere als Fluffy und der Geruch ist auch nicht der beste. Die Konsistenz erinnert eher an Knete und er bröckelt recht schnell.,
1091,angel huerta,,"Un producto que me ha sorprendido, usado en fiesta infantil y los niños encantados, las bolas eran mas grandes de lo que me imaginaba, no son enormes pero estan bastante bien de tamaño. Recomendado sin duda como regalo de fiesta.",
1092,sonja ,,Wir haben diese Kugeln als Giveaways für den Kindergeburtstag meiner 8 jährigen Rochter gekauft. Alle fanden es super.,
1093,Hans,,Beautiful colours,
1094,meggie neves,,Wide assortment keeps my child busy,
1095,AF,,"I ordered this for my (almost) 3 year old daughter who LOVES slime. She was SO excited to open the pack and see 24 little tubs of slime, and immediately grabbed 4 tubs to open. As soon as she took the first one out of the package a piece fell off. She was in near tears and she ""broke"" the slime.  We grabbed another tub and when she tried to stretch the slime, it just ripped off. If she squeezed it, it broke into a million pieces, and she got tiny little globs of slime everywhere. She was so disappointed.  I recall reading some decently positive reviews, so I scrolled through and found a review that says you just have to work it in.  So I grabbed the slime from her, and ""kneaded"" the slime for 15 minutes.  Not only was it now in a million pieces all over my floor, my hands were covered in the galaxy slime, and it looks like something my dog would have thrown up. If you leave it to ""rest"", it all comes back together and has a nice sparkle to it.  So it's a nice ""look but don't touch"" slime... but who gets slime to just look at??I guess the positive side of the slime is that it looks pretty, so good to gift away, because it's not something I would want in my house.",
1096,Marina Eichwald,,Nicht gut,
1097,Gioia Gaudia,,"Comprate come regalino per gli invitati ad una festa di compleanno, le palline sono veramente carine e ben fatte. Lo slime all'interno non fa cattivo odore e non sporca né macchia, non si sbriciola né si attacca ai vestiti. Le consiglio",
1098,LOREDANA,,Per il prezzo speso vanno più che bene. Sono come delle palline di ping pong. Si aprono e dentro c'è lo slime. Non è elastico al massimo ma ha dei bei colori..,
1099,Sabrina,,"Idée cadeau pour ma fille mais convient mieux pour un cadeau de kermesse Etc .. car il y a 24 petites balles avec un slime dedans , il y a des couleurs différentes mais bon pour la même personne ça n’est pas utile d’avoir 24 boules",
1100,Rodolfo,,"Consegna puntuale,i 24pezzi sono variegati ,non troppo colorati,ma con alcuni pezzi (4/5) più  da femmina con glitter,paperelle,fiorellini. Ideali per me che devo impacchettarli insieme ad alcune caramelle come regalino post party. La dimensione è più o meno di una pallina da ping-pong. Le parole del mio bimbo quasi cinquenne:<< lo slime è perfetto,non appiccica,brilla e profuma di sole 😅>>",
1101,Janelle Desjardins,,I was very disappointed as these slimes were hard when they were received. You could kind of stretch them but they would break. It definitely did not have the texture of slime that I was expecting.,
1102,Isa,,"Wir haben den Schleim als Mitgebsel/Beschäftigung zum Schulanfang gekauft. Er ist in kleinen Plastikkugeln verpackt, diese liegen in einem Karton mit Platzhaltern. Die Farben sind schön. Der Schleim riecht nicht und klebt nicht, hinterlässt keine Schleimdpuren auf Tisch ect.. Wenn er geknetet wird, wird er etwas fester und kann als Kugel auch springen. Man kann ihn zerteilen und er fügt sich schnell wieder zu einer Masse zusammen.Die leeren Kugeln gehen leider etwas schnell kaputt. Wir haben dann in Plastikeier umgepackt. Auch nach 3 Monaten ist der offene Schleim noch top.Es hatten nicht nur die Kinder Spaß. ;)Ich würde ihn auch nochmal kaufen.",
1103,Derick m.,,Do not buy this productThe slime is low quality it breaks apart and makes a mess all over the houseThe slime also comes on tiny shot glass cups not as advertised.,
1104,braune Engel,,"Hallo,Wir haben es für unsere Tochter zum Geburtstag bestellt.Es ist vollständig und unbeschadet bei uns angekommen.Es ist bei unsere Tochter und den anderen Kindern ( Geschwister und Gäste) sehr gut angekommen. Auch wir Erwachsenen konnten nicht die Finger davon lassen.Ich kenne noch den Gliebber von meiner Kindheit und der Geruch ( der schon etwas eigenwillig ist) hat mich sofort in meiner kindheitserinnerung versetzt.Minimal klebrig... Daher zu empfehlen es nicht auf Teppiche, decken, oder sandige Untergrund zu bespielen.Was sehr schön ist :Die FarbenGute einzelne Portionsgrössen ( zum teilen wichtig😉)Der extra Glipper in der untersten Reihe der durchsichtig ist und kleinere Gegenstände eingearbeitet ist..... machen das Set vollständig und lassen für uns keine spielwünsche offen.Das einzige was etwas schade ist:Der Gliebber ist ja in einzelne kreisrunde Plastikbehälter porzioniert ( was ja sehr schön ist) doch das Plastik ist sehr dünn und spröde.... Was zu Folge hat das es bei minimalen druck kaputt geht..... und somit die Aufbewahrung des Gliebber etwas schwieriger macht.Tip hier: Wir haben uns da mit leere ü-eier geholfenWir sind bis auf den kleinen Verpackungs sache sehr zufrieden und geben wegen dem spielspass und der Menge an Gliebber 5 SterneIch hoffe die Bewertung hilft euchLg",
1105,Interessentin 1,,"Stinken zwar chemisch,  macht sich dennoch in der Mitbringsel- Tüte gut.",
1106,Tiziana critica d'arte,,"Acquistati come gadget per la festa di compleanno del mio bambino di 6 anni.Il regalo è piaciuto molto ai bimbi che alle bimbe. Ci sono diverse varietà alcune palline sono glitterate altre invece contengono al loro interno piccoli oggetti come stelline, cuoricini o paperelle. Le palline sono un po’ piccole rispetto alle aspettative. In ogni caso fanno la loro bella figura",
1107,Elena,,Ce n’est pas le type de slime qui se recolle si vous la séparer elle n’adhère plus ensemble et vite ça devient plein de petit morceau et ça fait beaucoup de dégât. En plus les pots sont minuscule.,
1108,Josiane Mello,,Sono molto belli e il più importante è che non sono troppo mole e non si attaccano ai vestiti,
1109,Amazon Customer,,"If you try to stretch up you have to do it very slowly otherwise is going to break in parts, so for toddlers, I won't recommend, also you can't mix colours, so you have to play carefully with it if you want to keep all colours",
1110,🍄Mushroom🍄,,Not stretchy at all and breaks easily,
1111,Abraham Casal Malvido,,"Es un slime bastante duro y las bolas son pequeñas, del tamaño de una pelota de Ping Pong. Por lo demás son muy bonitas y dos de ellas traen un pequeño muñequito",
1112,ChK,,Kam super an als Gastgeschenke bei der Geburtstagsfeier meines Sohnes.,
1113,Gloria,,"Non è slime, si spacca in tanti pezzi.Per quanto le palline siano carine, l’articolo è vecchio. Sicuramente non è uno slime.Restituito.",
1114,Elfiepumpkin,,"High quality slime, in hard wearing globe containers.Beautiful colours, with no ball looking exactly the same.Slime is easy to handle and not at all sticky, so not found clung to items everywhere!Only small criticism, is it might be nice to have a few of the random balls in  there, the o es with the added confetti etc, or themed slimes, but as it is called galaxy slime I suppose these ones will be less apparent!All in all a great buy and would buy again.",
1115,Elif Kurtoglu,,"Habe ich für meine Schüler geholt, sie haben sich gefreut, war an sich alles in Ordnung aber ich finde das Preis-Leistungsverhältnis ein wenig unverhältnismäsig. Insgesamt ein wenig zu teuer, den Kindern gefällt es aber.",
1116,Liz,,"Ich habe die Kugeln als Mitgebsel zum Kindergeburtstag meiner 6- jährigen Tochter bestellt. Die Lieferung kam schnell und unbeschädigt an. Die Kugeln waren der Renner bei den Kindern. Sie kamen supergut an.Nach ein paar Tagen jedoch finde ich überall Klebespuren von den Schleimkugeln. In der Artikelbeschreibung steht, dass der Slime keine Klebespuren hinterlässt, doch das tut er definitiv! Auf Kissen und Kleidung und und und....Mit der normalen Wäsche ist es nicht rausgegangen, worüber ich mich jetzt im Nachhinein sehr ärgere.",
1117,sara,,Non sono buoni sono secchi e piccolissimi,
1118,Melanie ,,Sehr gutes Material,
1119,Alessandra ,,"Non è per niente elastico, si spezza e le palline sono piccolissime",
1120,Kwasi Thompson,,Good,
1121,deborah,,"I bought the slime kit for my slime obsessed granddaughter , I wanted some thing different , unique gift and my granddaughter loved it , the slime is not sticky and the little gifts inside some of the pods is such an extra bonus !!! So pleased with this kit . Highly recommended",
1122,RA,,"Ordered these as favours for my daughters birthday coming up in a couple days.  When I received the product, box was beat up a bit and half empty.  Returning immediately.  Re-bought because her heart was set on these, lets hope it doesn't happen again!",
1123,Leslie Brasme,,Rigolo ce slime dans les petites sphères  en plastique dommage que beaucoup de couleur se ressembleParfait pour un anniversaire,
1124,helene,,Acheté octobre pour un anniversaireTous allait bien au débutEt depuis on met petit à petit le slim à la poubelleIl mousse ça dégouline des boîtes il pue de plus en plusC'est immondePour le prix c'est cher,
1125,Cor ignis,,"La cara de mi peque cuando los vió fue un poema. Es un pack perfecto para tener un detalle con los peques tras un cumple y no dar siempre la bolsa de chuches.Vienen 24 bolitas de plástico redondas, con diferentes colores de slime, algunos espaciales, otros transparentes y unos cuantos con alguna sorpresa dentro (minipatitos)El único pero es que hay que ir con cuidado, porque las manchas de este slime no se quitan, se endurecen en los tejidos cuando se secan y no hay manera humana de sacarlos.Y por tejidos me refiero a ropa y también a tapicerías de coche..Aún así, muy bonitos",
1126,Tamara,,"Erster Eindruck süß und klein. Toll ist das jede galaxy noch einmal extra verpackt ist.Eine tolle Farbwahl, lebendige schöne Farben. Dann nach der ersten geöffneten galaxy wurde ich leider süchtig. Dachte ja weil Chinaware meist stinkt und Chemie und so.... Aber dieser Geruch von dem slime ist der hammer. Kennt ihr diese citronen Armbänder gegen mücken? So duftet der slime. Eine citronengalaxy. Wunderbar ist auch das der slime nicht an der Hand oder Kleidung klebt. Somit darf auch mal die jüngste (3 Jahre) mal mit slimen.",
1127,rachell victoria stanley,,I was silly enough to ignore some bad reviews. Thinking there are just as many good ones!! Don’t be fooled.I purchased 2 sets one for my nieces & one for my daughter. Totally just shy of £35 for two sets........These “slimes” are no longer slime....... I believe at one point they would have been “slime” but clearly these have been stored in the wrong environment (that’s My guess due to them been so cold on opening tubes) & they have turned to gel that just tears apart.I was gutted for my 2 year old who’s taken a big liking to my nieces slime collection. These are stunning..... very pretty and eye catching......... but aren’t any good for kids to play with unless they like crumbling useless Gel.Thankfully I got my money back on both sets as I returned them as they aren’t fit for purpose for sure.,
1128,Daniele,,"Le palline di slime sono piaciute tanto ai bambini a cui le abbiamo regalate per intrattenersi durante una festa di compleanno. Peccato purtroppo che i colori non rispecchino quelli delle foto, sono molto più spenti ma i bambini ci fanno meno caso di noi! Non si attaccano facilmente in giro e questo è un vantaggio, attenti solo a non pestarle...",
1129,Anna ,,"Kind ist begeistert. Wir haben einen Adventskalender daraus gemacht. Der Schleim ist eine gute Qualität. Niedlich versehen mit kleinen Teilchen, wie Perlen und.s.w.. Gerne wieder.",
1130,Sarah,,I'm going to buy more! I bought them as party bag fillers and I love those! The slime smells nice and doesn't get sticky or dirty. It leaves a wet feeling on your hands that lasts a few seconds but no residue.  It is honestly the best slime I have found! And the galaxy balls really look amazing in colour.I really recommend!,
1131,Tezi.A89,,"These slime balls are great. They are more like a putty rather than slime, my girls are 3 & 8 and they love them.Perfect for little ones however there are some small bits & pieces in the 5 clear/colour slimes so I'd advise adult supervision if like my 3 year old, they like to put things in their mouth.",
1132,Rosina Marks,,"I have no idea why kids love these slimes so much, but I'm happy it gives so much joy to children. Good quality product and those slimes are very fun to play with as well. Your child won't be disappointed. :D",
1133,Nancy Bernsdorf,,"Dieser Artikel war nicht mehr als 5€ wert. Unverschämtheit, ihn derart teuer zu veräußern.Ich war erschrocken beim auspacken, als ich die Ware sah.Die Sterne gerne ich nur für die reibungslose und schnelle Abwicklung was die Rücksendung/Reklamation angeht",
1134,Dana,,"Sehr schön und gut , wieder gerne kaufen",
1135,honeyball,,"Die Dinger sind ganz lustig. Auch richtig slimig scheint aber nicht zu kleckern.Leider kam es dazu, dass die Dinger nach ein paar Tagen im Döschen übelst gestunken haben. Richtig widerlich.",
1136,Püppi2009,,"Nur nett anzusehen.Slime nicht wie man es kennt. Lässt sich nicht ziehen, reißt sofort und lässt sich dann nicht wieder zusammen kneten.  Geruch ist erträglich.Nach einiger Zeit nicht Nutzung wollte meine kleine wieder mit ihrem slime spielen, leider mit großer Enttäuschung. Slime hat wurde sehr flüssig, stank und war nur noch gut für die Mülltonne. Kommt Slime mit Decken, Kleidung, Teppich oder sonstiges aus Stoff in Berührung bekommt man es nur sehr mühsam entfernt oder garnicht.Werde es nicht wieder holen und würde es auch nicht weiterempfehlen.",
1137,Jessica Rigoli,,Il prodotto è ottimo soprattutto se messo in paragone con alcuni Slime che esistono in commercio e che sono molto più pubblicizzati. Il prodotto Infatti non appiccica non incolla Ha un buon profumo I colori sono molto apprezzati dai bambini. Inoltre essendo in quantità così piccole richiudibili lo Slime non si secca e si può anche dilazionare il regalo nel tempo senza doverlo aprire tutto insieme.  assolutamente consigliato,
1138,Magracino,,Carinissime palline usate per prepare i gadget di fine festa. Ogni pallina ha un diametro di 3 cm circa. Non sono tutte brillantino se ma alcune sono trasparenti con pezzetti di frutta. Quindi le volete tutte dello stesso tema dovrete prendere più confezioni,
1139,Wil,,Meilleur jeu de slime pour ma fille,
1140,temblor,,Distrutto in poche ore dalla bambina. Poco resistente,
1141,easyKriGa,,"Also, das Paket kam gerade an. Bin wirklich begeistert. Diese Slimekugel sehen wirklich toll aus. Habe mich mit der Bestellung ja etwas schwer getan weil es ja (nur) ein Gastgeschenk sein soll und ich es zusammen mit den anderen Dingen nicht zu teuer werden lassen wollte, aber es lohnt sich. Hier ist alles bombenfest. Nix läuft aus. Sieht absolut toll aus. Und sie haben eine wirklich ausreichende Grösse. Klar grösser geht immer aber im Preis Leistung gesehen .....Top.Wurde auch super schnell geliefert. Gestern bestellt, heute da.",
1142,LucyLu,,Ich habe ein paar der Kugeln mit in die Überraschungstüten beim Kindergeburtstag getan. Die Freude war groß. Ich empfindet es allerdings mehr als Knete als Schleim. Und der Preis ist auch zu hoch. Trotzdem ein vielseitiges Spielzeug.,
1143,Sabine,,Ich habe diesen Galaxy Slime meiner Tochter zum Geburtstag gekauft leider ist es nicht wirklich ein Slime. Er reißt extrem schnell auch wenn er aufgewärmt ist und ist von der Beschaffenheit eher hart nicht schleimig so wie Slime eigentlich sein müsste.Meine Tochter hat trotzdem Spaß dran gefunden und das ist die Hauptsache.Aber kaufen würde ich Ihn nicht nochmal.,
1144,Paul,,Enkel fahren voll drauf ab :-) Sind aber Besser als die großen Quetschkugeln. Finde aber die sehr kleinen Innereien der Kugeln nicht schön. Die größeren Innenteile gehen aber.,
1145,ARTE,,Ho acquistato queste palline come regalo di fine festa per il compleanno di mia figlia da distribuire ai suoi amichetti. Le palline di slime sono veramente molto carine e colorate. É stata mia figlia a sceglierle.,
1146,Indivie 79,,"Kann noch nichts sagen, kommt in den Weihnachtskalender",
1147,Verena Holz,,"im ersten Moment sieht es aus und fühlt es sich an wie man es sich vorstellt, doch beim kneten bricht der slime und bröckelt auseinander. sehr schade :/",
1148,Amazon-Kunde,,Ich habe damit den Adventskalender meiner Tochter befüllt. Das ganze kam super an. Die einzelnen Kugeln gehen nur leider super schnell kaputt und dann schleimt alles voll.,
1149,Cliente Amazon,,Tanto apprezzato,
1150,Stefanie Strung,,"ich persönlich mag die Kugeln gar nicht, da sie mir teilweise einfach viel zu glitschig sind. ich bevorzuge eher den Schleim, der zwar schleimig ist, aber nicht so extrem an den Fingern klebt, wie dieser. die Farben sind schön, aber der Rest ist nicht meins. würde es nicht nochmal kaufen.",
1151,JoyBoy,,"Un juguete muy entretenido, comprado para jugarlo con mi sobrino, y al final me he divertido tanto como él.Se hace divertido ir abriendo cada bola e ir descubriendo los diferentes colores de cada uno.Algunas son más elásticas o más pegajosas que otras, van mejorando el tacto después de jugar un rato con ellas, ya que se van calentando.  Pasados unos días nos entró la curiosidad de mezclar algunas bolas y crear nuevos colores. Hay diversión para rato!",
1152,Carmen Fritsch,,"Würde unter Adventskalender angepriesen. 24 einzelne Kugeln mit Schleim, der beim ersten Ziehen reißt. Sehr enttäuschend",
1153,Francesco,,Confacente alle aspettative,
1154,Andreas,,Im großen und Ganzen super! Nur leider war eine der Slimekugeln in der Packung kaputt und ist ausgelaufen...somit ein ganz klein wenig Enttäuschung beim Kind. Ansonsten ist das Produkt toll und kommt gut an!,
1155,Lucio,,"Salve,stupende e pratiche, ho preso queste palline di slime per mio figlio, sono rimasta prima io colpito dalla alta qualità del prodotto e dalla fatto di essere così vari colori e tipologie che non si stanca mai di giocare. come si vede in foto, sono colorate, trasparenti, con le perline, con le paparelle, tanti modelli e tanti modi di giocare che stiamo ormai giocando solo a questo. Poi lo slime è davvero un gioco carino e facile da fare che sono davvero soddisfatto da questo articolo. lo consiglio",
1156,Cliente Amazon,,"Prodotto vecchio, secco",
1157,livet mikckael,,"Slime un peu caoutchouc, ma facile a magner...mais ma fille reste quand même contente",
1158,furgy,,"Diese Knete ist richtig super, wir lieben sie, sie bleibt nicht kleben, man kann super damit spielen, auch die kleinen Obststücke und Entchen sind super süß. Einfach perfekt.",
1159,Obedie,,Bought as prizes for kid’s competition. Awesome little pockets of slime and sparkle.If you like that kind of thing.Which I don’t.But hey- doing it for the kids....they loved them.Their parent’s probably hate me.Modern day dilemma.,
1160,Dmytriy,,"Tiene olor agradable, no se Mancha. Pero no es elástico. Colores bonitos. Lo he comprado para la piñata. Es juguete para una fiesta, para el uso continuo no sirve",
1161,Katze,,Habe das Produkt  hier im Angebot  gekauftIch muss  sagen  es ist toll  ist gut zum Geburtstag  angekommen,
1162,Volkmann,,Alles super und ein tolles Mitgebsel,
1163,Käufer 1985,,An sich ganz witzig aber viele gleiche Bälle. Größe ist perfekt und schleim ok.,
1164,Lauraxxx,,I got these to help with toilet training my 5 year old autistic daughter .. she love slime and these are perfect for an award when she uses the toilet,
1165,Cliente Amazon,,"La confezione sembra perfetta, tante palline colorate che invogliano al gioco. Se si apre la pallina però la delusione è grande, non è slime ma un sorta di plastilina che si rompe durante il gioco. Sconsiglio l'acquisto",
1166,Mihalina R.,,Könnte mehr vielfältiger sein  . Sonst hat das Kind viel Spaß damit gehabt .,
1167,So. K.,,"Dem Titel nach sollte es sich um einen Adventskalender handeln, nun ja es sind 24 Kugeln drinnen, stimmt, aber es ist einfach eine offene Box wo man sofort alle Kugeln sieht. Ohne Türchen, ohne Nummern, ohne Überraschung. Das ist sehr schade!",
1168,Cliente Amazonc,,"È  piaciuto molto perché ci sono tantissimi slime, certo non  molto filanti, ma cmq per un bambino appassionato va più che bene",
1169,Amazon Customer,,Great for party bags!,
1170,Kielermädchen,,"Die Kugeln sind sweet, sie sind so klein das sie in einen Adventskalender passen. Für Kinder unter 6 Jahren allerdings nicht geeignet, es gibt Schleim der kleine Teile enthält und leicht zu verschlucken sind.",
1171,Amazon Kunde,,Ich habe als Adventskalender für meinen Sohn gekauft und er war sehr zufrieden,
1172,HAIFISCH,,Alles Schick!,
1173,Cloclo,,Se casse en pleins de petits morceaux et inutilisable,
1174,Amazon Kunde,,Es ist für ein Kindergeburtstag der Hit. Es ist aber nicht die beste Qualität. Es sind sehr schöne Farben. Der Schleim riecht aber ein bisschen komisch. Aber Kindern gefällt es.,
1175,Grace,,"They are tiny, not worth price.",
1176,simone,,tutto perfetto solo le dimensioni un pò contenute,
1177,Susan,,"Sehr schön, nur muss der Schleim richtig geknetet werden bevor man ihn ziehen kann. Riecht sehr chemisch...",
1178,Shopping Girl,,"Meine Kinder lieben Schleim und deshalb habe ich ihnen zum Kindertag dieses große Packung Schleimbälle bestellt. Es gibt 24 verschiedene Modelle, teilweise mit Figuren. Der Schleim leuchtet in den schönsten Farben. Wir bewahren den Schleim in den gelieferten Kugeln auf. Ein toller Spaß für Groß und Klein.",
1179,lets_test_togehter_,,⍟⍟⍟⍟⍟⍟⍟⍟⍟⍟⍟⍟Wir haben die Slimes als kleine Abschiedsgeschenke für die Geburtstagsparty unserer kleinen gekauft.Die Slimes sind einzeln in kleinen Kugel verpackt und noch zusätzlich verschweißt. Die Farbgestaltungen sindrichtig schön Galaxy-mäßig :-)Alle Kids sind happy und Slimy nach Hause gegangen.⍟⍟⍟⍟⍟⍟⍟⍟⍟⍟⍟⍟,
